{
  "$schema": "../song-language.schema.json",
  "language": "en",
  "htmlLang": "en",
  "indexFile": "index.html",
  "churchName": "Thuruthicadu Mar Thoma Church",
  "collectionTitle": "Carol Rounds Songs",
  "description": "Carol Rounds songs from Thuruthicadu Mar Thoma Church",
  "fontClass": "",
  "songs": [
    {
      "slug": "aadi-aadi-paduvaan",
      "title": "Aadi Aadi Paaduvaanayi",
      "listLabel": "Aadi Aadi Paaduvaanayi",
      "order": 16,
      "lines": [
        "Aadi Aadi Paaduvaanayi",
        "Naattil Kondaaduvaan",
        "A. A. Aaa...",
        "Aadi Aadi Paaduvaanayi",
        "Naattil Kondaaduvaan",
        "Veeduthorum Nammalellam Thulliyaadi Pokanam (2)",
        "",
        "Vannallo Shaanthi Poyallo Shantakal (2)",
        "Illaallo Malsaram Naam Onnaayi Paaduvaan",
        "Naam Onnaayi Paaduvaan",
        "",
        "(Aadi Aadi Paaduvaanayi...)",
        "",
        "Raajaadhi Raajan Bethlehem Goshalee (2)",
        "Bhoojaatham Cheythathaam Vaarthayai Paaduvaan",
        "Vaarthayai Paaduvaan",
        "",
        "(Aadi Aadi Paaduvaanayi...)"
      ]
    },
    {
      "slug": "aanandham-aanandham",
      "title": "Aanadam Aanadam Aaha Maanavare",
      "listLabel": "Aanadam Aanadam Aaha Maanavare",
      "order": 12,
      "lines": [
        "Aanadam Aanadam Aaha Maanavare",
        "Swarlokarellam Bhoolokarkum Innu Pirannallo",
        "Unni Pirannallo",
        "",
        "Bethlehem Pulkkoottil",
        "Mary Thannude Suthanayi",
        "Unni Pirannallo ....... Yeshu Pirannallo (2)",
        "",
        "Happy Christmas... Happy Christmas... Happy Christmas...",
        "",
        "( Aanadam Aanadam ....... )",
        "",
        "Kizhakkinnu Shastrimaar",
        "Thaaraththinte Gathi Nokki",
        "Vannu Gamichallo Kaazhchakal Vachchallo (2)",
        "",
        "Happy Christmas... Happy Christmas... Happy Christmas...",
        "",
        "(Aandam Aandam ....... )"
      ]
    },
    {
      "slug": "aattidayarkoru",
      "title": "Aattidayarkoru Modamudichavar Ezunnuettu",
      "listLabel": "Aattidayarkoru Modamudichavar Ezunnu",
      "order": 13,
      "lines": [
        "Aattidayarkoru Modamudichavar Ezunnuettu",
        "Palayugam Nokki",
        "Kando Raajakumaaran, Mary Kaannmaan Yaathraayi -(2)",
        "",
        "Jyothissu Vaasikal Ottukkurichu Paranjathupole",
        "Avar Chonnapole",
        "Sheeghram Poornamodam Eerivannu Yaathraayi -(2)",
        "",
        "Avar kandathu Vaikkuvaththaare",
        "Nokki Nadannathu Doore",
        "Kandavar Komala Baalane",
        "Besh - Besh - Besh",
        "",
        "(Aattidayarkoru Modamudichavar ...)",
        "",
        "Aththalakkatti Sukhaththae Muttum Paadaththinkal",
        "Ponnnu Paadaththinkal",
        "Avar Ponnnu Mooru Kunthirikkam Kaazhchavachu -(2)",
        "",
        "Avar kandathu Vaikkuvaththaare",
        "Nokki Nadannathu Doore",
        "Kandavar Komala Baalane",
        "Besh - Besh - Besh",
        "",
        "(Aattidayarkoru Modamudichavar ...)"
      ]
    },
    {
      "slug": "chandranumtharangalum",
      "title": "Chandranum Thaarangalum",
      "listLabel": "Chandranum Thaarangalum",
      "order": 2,
      "lines": [
        "Chandranum Thaarangalum",
        "Theliyunna Sheethala Raavil",
        "Lokathin Paalakanaayi",
        "Uyirekum Naathan Piranne",
        "",
        "Varuvin Varuvin Modamode",
        "Pullkoottil Chennonnu Kandeedaam (2)",
        "",
        "Kaikalanakki Melle Kannu Thurannu",
        "Kunji Lokathin Muthayi Theerneedunnu",
        "Maryathin Makanayi Maalokarkellaamee",
        "Snehathin Vachanangal Nalkeeduvaan (2)",
        "",
        "Bhooolokavum Ee Maalokarum",
        "onnayi Ninne Stuthicheedunnu (2)",
        "",
        "La La La La La La La La La La",
        "La La La La La La La La La La (2)",
        "Chandranum. (Chandranum Thaarangalum..)"
      ]
    },
    {
      "slug": "dhayvadhoodhanmaar",
      "title": "Rajarajaneshurajan Inneeravathil",
      "lines": [
        "Rajarajaneshurajan Inneeravathil",
        "Lokathinte Rakshakkaayi Jaatham Cheythallo",
        "Devadeva Paithaline Kanduvaṇangaan",
        "Aattidayar Koottamaayi Yaathraayaalloo",
        "",
        "Daivadoothanmar Onnu Cheythu Paadi Unnathangalil Daivamahathwam (2)",
        "",
        "Swargabhavanam Parityajichu Kaalikkoottil Vannu Pirannu",
        "Aadaminte Paapam Pookkidaanayi",
        "Daivaputhran Marthyanayallo (2)",
        "",
        "(Daivadoothanmar Onnu Cheythu Paadi ...)",
        "",
        "Agnirathathil Adhivasikkum",
        "Maalakhaamaarude Adhipan",
        "Shishuvineppol Kanyakathanthae",
        "Madhithattil Urangiyallo (2)",
        "",
        "(Daivadoothanmar Onnu Cheythu Paadi ...)",
        "",
        "Tune : Karthavin Vaaravil Namme Eduthidumpol",
        "",
        "reference https://youtu.be/uWYPMAzFhhk?si=8IRNllTNSF6MyBUd"
      ]
    },
    {
      "slug": "gabriyelinte",
      "title": "Gabriyellinte darshanasafalyamaayi",
      "listLabel": "Gabriyellinte darshanasafalyamaayi",
      "order": 21,
      "lines": [
        "Gabriyellinte darshanasafalyamaayi..",
        "Sarvalokarkkum nannmayaekum karunyamaayi",
        "Bethlaheminte maariloraaromal unni pirannallo (2)",
        "Vinnil thaarakal punchiri thooki",
        "Mannil Gloria naadangal paadi",
        "Avan pallikkacha aninjittu kannumchimmi thurannittu",
        "Kunjikkalittadikukayaayi..",
        "Ennum aaghosham unarukayaayi",
        "",
        "Hey.. dooreninnum thangathil",
        "Sammanangal kondeethi.",
        "Rajaakkalmaar onnaayi neele",
        "Vaazhthippadi.. Ye.. Hallelujah ...",
        "Ennum ninne lokathaayi",
        "Ullorellam vaazhthunne",
        "Innum ninte snehathaaley",
        "Dhanyam dhanyam vaaneedunne",
        "Raajadhiraajane ente maargadeepame",
        "En jeevadhaarayil chaithanyamaakane",
        "Ulkkoottile pulpaayayil",
        "Kanivaayi vaazhane..",
        "",
        "Pottaas pookkutti kambithiri ...",
        "Mathaappu rocket chembuthiri",
        "Gabriyellinte darshanasafalyamaayi..",
        "Sarvalokarkkum nannmayaekum karunyamaayi",
        "Bethlaheminte maariloraaromal unni pirannallo",
        "Unni pirannallo.. unni pirannallo",
        "Vinnil thaarakal punchiri thooki",
        "Mannil Gloria naadangal paadi",
        "Avan pallikkacha aninjittu kannumchimmi thurannittu",
        "Kunjikkalittadikukayaayi..",
        "Ennum aaghosham unarukayaayi"
      ]
    },
    {
      "slug": "kannum-kannum",
      "title": "Kannum Kannum Kaathirunnu",
      "lines": [
        "Kannum Kannum Kaathirunnu",
        "Manniloru Paithalinaai",
        "Kathodu Kathoram Kettirunnu",
        "Daivaputhran Pirakkumennu",
        "- Kannum Kannum Kaathirunnu",
        "",
        "Aakasha Veedhiyil Malaakka Maaravar",
        "Snehathin Nirakudamaai",
        "Thalaattu Paadi Urakkeeduvanaayi",
        "Manathaaril Ninachirunnu - 2",
        "",
        "Ethra Nalla Snehatthe",
        "Thanna Nalla Naadhane",
        "Melle Raavil Paadi Sthuthikkaam - 2",
        "",
        "- Kannum Kannum Kaathirunnu",
        "",
        "Jeevante Paathayil Kaarunya Kanavaai",
        "Karunardran Alinja Dhinam",
        "Aalolamatti Laalichiduvanaayi",
        "Krupayil Niranjirunnu - 2",
        "Ethra Nalla Snehatthe",
        "Thanna Nalla Naadhane",
        "Melle Raavil Paadi Sthuthikkaam - 2",
        "",
        "- Kannum Kannum Kaathirunnu"
      ]
    },
    {
      "slug": "kannumkannum",
      "title": "Kannum Kannum Kaathirunnu",
      "listLabel": "Kannum Kannum Kaathirunnu",
      "order": 1,
      "lines": [
        "Kannum Kannum Kaathirunnu",
        "Manniloru Paithalinayi",
        "Kaathodu Kaathoram Kettirunnu",
        "Daivaputhran Pirakkumennu (2)",
        "",
        "Aakaashaveethiyil Maalaakhamaaravar",
        "Snehaththinte Nirakudamaayi",
        "Tharaattupaadi Urakkeeduvanaayi",
        "Manaththaril Ninachirunnu (2)",
        "",
        "Ithranalla Snehaththae Thanna Nalla Naaththane",
        "Melle Raavil Paadisthuthikkaam (2)",
        "",
        "Kannum Kannum Kaathirunnu…….",
        "",
        "Jeevanthre Paathayil Kaarunyakanavaayi",
        "Karunaardran Alinja Dinam",
        "Aalolamaatti Laalichiduvaanaayi",
        "Kripayil Niranjirunnu (2)",
        "",
        "Ithranalla Snehaththae Thanna Nalla Naaththane",
        "Melle Raavil Paadisthuthikkaam (2)",
        "",
        "Kannum Kannum Kaathirunnu……."
      ]
    },
    {
      "slug": "kanyakayamma",
      "title": "Kanyakayamma Badalaheemin Pokunnueraam",
      "listLabel": "Kanyakayamma Badalaheemin",
      "order": 18,
      "lines": [
        "Kanyakayamma Badalaheemin Pokunnueraam",
        "Thuna Koode Poyoraousephum Thaanumaayi (2)",
        "Bethlehem Malancharive Pokunnueraam",
        "Amma Vidhana Sahiyaathe Pulkkooduthannil (2)",
        "",
        "Naalum Moonnum Randum Onnum Maasamaayi",
        "Appol Ponkumaaran Pulkkoodaththil Jaathanaayi (2)",
        "",
        "(Kanyakayamma Badalaheemin Pokunnueraam ...)"
      ]
    },
    {
      "slug": "munnamparasudhan-1",
      "title": "Munnampara Suthan Ambara Naayakan",
      "lines": [
        "Munnampara Suthan Ambara Naayakan",
        "Emmanuveloru Naariyaakum Marythan",
        "Nandhananomana Baalakan Aayaval",
        "Madiyilirunnanathum Vismayam",
        "",
        "Mannil Naranude Vadivu Dharichu",
        "Pirannoru Suravaranude Jananathe",
        "Ambara Suraganam Idayorodariyich-",
        "chathi Modichaarathum Vismayam",
        "",
        "Aattidayar Surar Cholliya Vaachakam",
        "Kettudanodiya Bethalahem Pul",
        "Koottilamarnnoru Shishuvine Vannavar",
        "Vandanam Cheithaarathum Vismayam",
        "",
        "(Munnampara Suthan Ambara Naayakan ...)"
      ]
    },
    {
      "slug": "munnamparasudhan",
      "title": "Munnam Parasuthan",